,Tweet
2268,NEW BOOK CLUB Something deeply amiss contemporary American culture Is post modern education blame maxeden99 joins michaeljknowles eye opening discussion The Closing American Mind
2269,
2270,Anti Semitism canary coal
2271,Is American government secular
2272,Remember sides wanted strong borders
2273,Do percentage Americans pay federal income taxes
2274,Cancel culture cultivates cowardice
2275,RT amalaekpunobi Minneapolis Man Who Shot At A Mom amp Kids Is The VICTIM Unapologetic LIVE
2276,RT amalaekpunobi They kids
2277,Going green cost environmental cost
2278,elonmusk energybants Liv_Boeree
2279,She graduated Harvard angry atheist taught hate America Hear story discovering truth reclaiming freedom
2280,Sending child college akin playing Russian roulette values
2281,NEW RELEASE Winning War Independence brought challenge American sort government choose nation McCormickProf presents full 5 Minute Video
2282,NEW VIDEO Why Republic Watch full 5 Minute Video
2283,Do kids watching mobile devices Finally trusted network offering fun educational content aligned values Check young minds grades K 12
2284,Which party founded KKK
2285,Even believe God wish
2286,There media truth But seek
2287,NEW RELEASE Winning War Independence brought challenge American sort government choose nation McCormickProf explores problems founders faced pivotal moment history
2288,Who tolerant
2289,The million dollar question
2290,What caused Civil War Did South secede slavery
2291,You debt college WATCH
2292,
2293,Special Release amalaekpunobi takes streets America racist WATCH HERE
2294,The trend
2295,Just sports power unite equal power divide
2296,Not trick question
2297,Powers scope national government left states This framers envisioned
2298,It takes amalaekpunobi 2 minutes debunk gender wage gap myth
2299,How criminal justice reform working
2300,Marxism perfect record failure That stop believers continuing believe Watch 3 part series Understanding Marxism understand ideas
2301,Watch
2302,How genders
2303,Socialism nutshell
2304,Freedom religion morphed freedom religion How happen
2305,Chris Elise pro sports photographer He speaking current woke athlete complex You hear story
2306,The left losing term groomers Liz_Wheeler amalaekpunobiWatch full interview
2307,RARE SIGHTING Common campus
2308,Many attempts redistributing wealth ended redistributing poverty Thomas Sowell
2309,RT JillSimonian
2310,
2311,WATCH Israelis Palestinians Who More Tolerant AmiHorowitz investigates
2312,What America biggest crisis benshapiro
2313,Do passion guide Make serve
2314,Just sports power unite equal power divide
2315,Watch latest Book Club
2316,Do kids watching mobile devices Finally trusted network offering fun educational content aligned values Check young minds grades K 12
2317,These types inflation SteveForbesCEO
2318,How stop
2319,2 000 1934 equivalent 40k today Inflation real phenomenon losing purchasing power passing year
2320,We hire video specialist Come work minded free thinkers PragerU For job open positions apply NOW
2321,Have heard partnership realDailyWire JeremyDBoreing JillSimonian dailywireplus
2322,RT amalaekpunobi EVERYONE Is Wrong About 10 Year Old Rape Victim Unapologetic LIVE
2323,
2324,
2325,College students 4 years heard conservative idea
2326,Why God things happen
2327,The left stomach diversity
2328,Catch amalaekpunobi hosting Dennis Prager national radio show Today 9 12 PT 12 3 ET
2329,Do divorce easily Watch full Fireside Chat
2330,It character race
2331,When truth
2332,The 1619 Project aims redefine American history discredit founding But big dilemma 1619 Project flawed
2333,Science political agenda
2334,Has inflation made change spending habits Let
2335,Watch NEW Fireside Chat
2336,When fear overcomes reason sheep
2337,Small Business Is America caroljsroth
2338,Do hate Israel question legitimacy free democratic nation Somehow manage focus energies Jewish country
2339,NEW Fireside Chat Watch full episode HERE
2340,Watch NEW Fireside Chat Watch rest
2341,Parents One important traits teach generation perseverance Learn Thomas Edison exemplified perseverance newest Craftory episode build light bulb balloon Watch JillSimonian
2342,RT MikhailaFuller A clip episode amalaekpunobi Do guys Depp Heard trial private Full epis
2343,amalaekpunobi reacting To WOKE posts popular Feminist Instagram
2344,I bullies I run bullies Clarence Thomas
2345,
2346,Why free nations deal government explicitly vows destroy Israel
2347,RT larryelder AmiHorowitz PragerU NEW RELEASE According left oppressor Israel oppressed Palestinians http
2348,RT JillSimonian Maybe Twitter nicer place latest prageru kids video part code conduct
2349,While appalling book Marxism calls teachers lead revolution
2350,RT AmiHorowitz My video violent intolerance Palestinians territories DennisPrager benshapiro larryelder
2351,WATCH Who tolerant AmiHorowitz investigates Let short documentary
2352,Even believe God wish
2353,The left rule hear thoughtful disagreement NYT Executive Editor Dean Baquet
2354,Is leftism escape
2355,Federalism It feature bug
2356,
2357,What America left wanted
2358,The greens nuclear energy reveals colors
2359,OUT NOW Israelis Palestinians Who More Tolerant Watch rest
2360,REACTION Elizabeth Warren Says Crisis Pregnancy Centers TORTURE Pregnant People amalaekpunobi Watch
2361,AmiHorowitz find
2362,Who tolerant minority groups
2363,John F Kennedy lowered taxes opposed abortion supported gun rights believed strong military He proud Democrat
2364,Small freedom kneel flag giants stood
2365,Ami Horowitz GUTS Here part story brand mini documentary
2366,The answer waiting
2367,OUT NOW Watch AmiHorowitz short doc
2368,RT SethDillon Remember Bill Maher rest panel laughed Dennis Prager Left insists menstru
2369,Inflation taxation legislation Milton Friedman
2370,OUT NOW Israelis Palestinians Who More Tolerant AmiHorowitz investigates
2371,When parenting priorities matter Are absorbed grades forgetting raise
2372,NEW SHORT DOC Israelis Palestinians Who More Tolerant AmiHorowitzWATCH NOW
2373,
2374,TOMORROW AmiHorowitz
2375,TheOfficerTatum struggled reconcile experiences media anti police rhetoric He speaking This story
2376,From wealth opportunity food lines This socialism worked Venezuela
2377,RT amalaekpunobi Can You Figure Out Who Pro Vaxx Who Anti Unapologetic LIVE
2378,Do headed recession 2022 Take poll
2379,TheOfficerTatum amazing story share For full story
2380,If America racist ethnic racial backgrounds world fight hard move
2381,TheOfficerTatum struggled reconcile experiences media anti police rhetoric He speaking This story
2382,COMING SOON Tomorrow July 13th
2383,Watch
2384,SteveForbesCEO message hear inflation
2385,Would stricter gun laws reduce gun violence
2386,
2387,There media truth But seek
2388,When nation leaders media turned law enforcement TheOfficerTatum began questioning taught black America This story
2389,A universe inflation
2390,When belief supersedes sanity
2391,Some Americans granted born lower class reach middle upper class Many Brazilians granted
2392,Did
2393,Never forget takedown CRT
2394,The world absurd satirized G K Chesterton
2395,RT amalaekpunobi Can You Be Racist Toward White People Unapologetic LIVE Reaction
2396,Has inflation made change spending habits Let
2397,To secure liberties understand
2398,Do agree
2399,NEW RELEASE What inflation How stop SteveForbesCEO breaks
2400,
2401,
2402,OUT NOW Watch full video
2403,Stop dreading Mondays See proximity principle
2404,Gun confiscation ends
2405,NEW RELEASE Look source society collapse find word inflation core So inflation SteveForbesCEO breaks
2406,ESG coming wallet values
2407,Democratic Socialism Socialism
2408,Before make mind abortion consider
2409,Is abortion
2410,Time waits Learn improve time management
2411,Masculinity celebrated
2412,I favor fairness I favor freedom Milton Friedman
2413,Public pensions ticking time bomb
2414,Why God things happen
2415,Going green cost environmental cost
2416,How reclaim educational system KaliFontanilla 1 Advocate academic transparency 2 Speak Express concerns 3 Take active role child education
2417,
2418,Capitalism system begins taking giving George Gilder
2419,Do kids watching Finally trusted network offering fun educational content aligned values Help reach young minds donate today
2420,Intersectionality hierarchy victimization
2421,
2422,God hate evil
2423,
2424,The time hear politician call common gun control listen details
2425,Yep
2426,Watch full video
2427,What kind future destroy past
2428,Gun confiscation ends
2429,The 1619 Project aims redefine American history discredit founding But big dilemma 1619 Project flawed
2430,Spending consequences Inflation
2431,RT amalaekpunobi Restaurant Calls Civility Toward Kavanaugh Twitter MELTS DOWN Unapologetic LIVE
2432,When retreat crime surges That widely agreed
2433,Know difference
2434,Has utility bill rising
2435,More data equals control It sound science fiction occurring eyes
2436,Freedom Innovation Prosperity
2437,Did The Watergate break significant part scandal
2438,Do kids watching Finally trusted network offering fun educational content aligned values Help reach young minds donate today
2439,Is abortion
2440,The bigger government smaller citizen
2441,RT JillSimonian Frank conversation amp PragerU Kids solutions inoculate children lies catch MatureAm
2442,NEW Fireside Chat The Danger Health Above All Watch FULL episode
2443,RT amalaekpunobi Has American Politics Become One Big JOKE Unapologetic LIVE
2444,amalaekpunobi
2445,Think hold biblical values If West mistaken
2446,RT AmiHorowitz Watch preview video
2447,If stop event modern history happening As historian World War I answer
2448,Israelis Palestinians Who More Tolerant AmiHorowitz Coming Soon July 13th Watch Trailer
2449,RT caroljsroth I coming DennisPrager 10 30a PT 1 30p ET talk economy latest prageru video
2450,RT AmiHorowitz I excited video coming July 13th exclusively prageru Stay tuned watch snea
2451,Wokeness shield cruel armored false virtue Elon Musk
2452,Socialism Venezuela nation adopts
2453,BIG ANNOUNCEMENT We full time house personality thewillwitt amp amalaekpunobiIf passionate sharing American values apply amp submit 2 minute video
2454,Israelis Palestinians Who More Tolerant AmiHorowitz COMING SOON July 13th
2455,A handful companies deciding participate public life Scary Watch full documentary
2456,This question
2457,There media truth But seek
2458,Watch
2459,amalaekpunobi
2460,NEW RELEASE thewillwitt takes street Watch
2461,Watch full video
2462,RT amalaekpunobi Why Is The Media Ignoring The Dutch Farmer Strike Unapologetic LIVE
2463,YosephHaddad And 1 4M views
2464,RT YosephHaddad A million viewers world video prageru 6 minutes receive trut
2465,Unnecessary medical gender transition irreversible damage
2466,Parents demanding And deserve So kids Learn
2467,Science deny existence God Science greatest advocate
2468,Chris Elise pro sports photographer He speaking current woke athlete complex You hear story
2469,What Parents Don show video book kids thewillwitt
2470,There racist targeting entire ethnic group collective crime innocence guilt individuals
2471,Make cancellable
2472,Anne Frank Diary Young Girl vivid accounts life Nazi occupied Holland World War II Do Americans today idea thewillwitt finds
2473,
2474,The bear arms constitutional issue women rights issue
2475,Do kids watching Finally trusted network offering fun educational content aligned values Help reach young minds donate today
2476,Clarence Thomas bowed mob
2477,Covid lockdowns direct assault small businesses secret America economic engine How protect small businesses moving forward
2478,RT amalaekpunobi Is It Trendy To Hate America Unapologetic LIVE
2479,Work minded free thinkers PragerU We VP Marketing work directly CMO
2480,amalaekpunobi
2481,Why push conformity
2482,Watch NEW 5 Minute Video small business Watch full video
2483,How ensure patriotism remains strong country
2484,When parenting priorities matter Are absorbed grades forgetting raise
2485,Suppressing speech AFTER hits internet late sending Officer Witt catch crimes BEFORE sprout disinformation
2486,By definition gun control laws guns hands law abiding citizens
2487,After 5 TRILLION govt investments Fossil fuels provide 84 world energy Oil powers 97 transportation
2488,Do percentage Americans pay federal income taxes
2489,There systemic racism coming media
2490,Rather working find cure biological cancer investor entrepreneur biotech CEO Vivek Ramaswamy fighting cultural cancer wokeism corporate America
2491,SALE Today visit PragerU store 25 OFF
2492,What proper role government
2493,Small Business Is America caroljsrothWatch
2494,RT caroljsroth My video w prageru today Small Business IS AmericaPlease watch share
2495,NEW RELEASE Small business epitome American Dream It reason America richest nation world After successful big business started small caroljsroth
2496,RT prageru POWERFUL God bless United States
2497,God bless
2498,Some Americans granted born lower class reach middle upper class Many Brazilians granted
2499,It critical children learn America founding Parents fun DIY craft teaches elementary students Paul Revere famous ride important part nation history
2500,
2501,SALE This weekend visit PragerU store 25 OFF
2502,If asked explain Electoral College
2503,The flag ALWAYS worth saluting FlyTheFlag ProudAmerican
2504,Let facts change
2505,RT prageru Watch
2506,You offer solutions address root Watch full short documentary
2507,RT JillSimonian Thank fabulous pictures God Bless God Bless America God Bless prageru parents educators
2508,RT JillSimonian Thank INSPIRING FourthofJuly kickoff foxandfriends God bless freedom fighters RCamposDuffy Pet
2509,Discipline path freedom
2510,Agree disagree
2511,America opportunity nations country world history FlyTheFlag ProudAmerican
2512,POWERFUL God bless United States
2513,This teacher refused force CRT harmful lessons students
2514,Because fine time American
2515,No country opportunity
2516,When truth
2517,How exist
2518,Comply
2519,The United States fight wars independence The course Revolutionary War Can It War 1812
2520,Watch
2521,This surprise
2522,When belief supersedes sanity
2523,Parents This weekend kids join PragerU favorite bulldog Otto important story time celebrates American values life amp liberty
2524,SALE This weekend visit PragerU store 25 OFF
2525,It government job solve problems
2526,Reminder
2527,PragerU CEO Marissa Streit joined Dave Rubin The Rubin Report discuss continued erosion educational institutions
2528,
2529,
2530,RT amalaekpunobi Week In Review SCOTUS Outrage amp The Liberal World Order Unapologetic LIVE
2531,When rule law breaks chaos Watch full episode
2532,Courage rarest traits desperately needed
2533,The flag ALWAYS worth saluting FlyTheFlag ProudAmerican
2534,RT JillSimonian How fend leftists 4th July A PragerU Kids Declaration Ceremony family friends Fast fun amp mos
2535,Get woke broke
2536,This
2537,Do fly American flag home Let
2538,If choose live God God lose
2539,FlyTheFlag
2540,Anti Semitism canary coal
2541,It critical children learn America founding Parents fun DIY craft teaches elementary students Paul Revere famous ride important part nation history
2542,No country sacrificed freedom countries America
2543,No government voluntarily reduces size President Reagan
2544,Can patriotism make comeback Watch fireside chat
2545,Watch NEW Fireside Chat
2546,
2547,Watch PragerU CEO Marissa Streit interview LaraLeaTrump
2548,Patriotism Roe Wade karma Watch NEW Fireside Chat
2549,Why private property competition profits dirty words Marxist
2550,SALE This week visit PragerU store 25 OFF
2551,Social justice euphemism left wing values
2552,Pledge FlyTheFlag
2553,Help flood social media American flags 4th July weekend FlyTheFlag
2554,America liberty opportunity nations country world history FlyTheFlag ProudAmerican
2555,Will Revere YOU FlyTheFlag
2556,Millionaire athletes victims That Chris Elise Hear story
2557,Something controversial flying American Flag 4th July politicized As proud American I pledge FlyTheFlag post social media I especially Independence Day RT stand
2558,Twitter suspended Jordan Peterson PragerU hand effects censorship As presenters stand Jordan Peterson Do Please sign petition Twitter free Jordan Peterson
2559,RT prageru Don mute opposing viewpoints Combat ideas ideas
2560,Want FREE PragerU bumper sticker Fill short form claim bumper sticker
2561,I failed I found 10 000 ways work Thomas Edison NEW episode How To series
2562,Just decade ago pushing sex gender ideology young kids outrageous What changed Watch latest 5 Minute Video
2563,Exactly
2564,The moment lose guise civilization things dark WATCH NOW
2565,RT JillSimonian A shocking awakening homeschools
2566,RT realDailyWire JeremyDBoreing As company great relationship PragerU Right PragerU
2567,RT realDailyWire yashar jordanbpeterson Welcome home realDailyWire jordanbpeterson prageru DW Movies amp coming
2568,RT realDailyWire We great relationship PragerU Now hosting content site D
2569,Watch JillSimonian interview KirkCameron
2570,Chief Staff opening Work CEO optimizing operations process metrics Join organization shares values To apply visit
2571,Think hold biblical values If West mistaken
2572,RT SethDillon I lot common adult prays football field game
2573,RT amalaekpunobi Gay Man CALLS OUT Radical Left In VIRAL Letter Unapologetic LIVE
2574,RT Not_the_Bee BREAKING Jordan Peterson suspended Twitter misgendering Elliot Page
2575,Watch video great Milton Friedman
2576,SALE This week visit PragerU store 25 OFF
2577,Standing Chinese communism ensure America safer stronger prosperous future
2578,MikhailaFuller jordanbpeterson elonmusk FreeJordanPeterson
2579,RubinReport jordanbpeterson elonmusk FreeJordanPeterson
2580,SIGN THE PETITION
2581,In order risk offensive This free speech jordanbpeterson FreeJordanPeterson
2582,FreeJordanPetersonSIGN THE PETITION Twitter unlock jordanbpeterson account
2583,RT JillSimonian Most Fun Meaningful Way To Teach Our Kids ABOUT 4TH OF JULY amp foundation blessings America Do
2584,WATCH JordanbPeterson powerful response called bigot Twitter currently suspended account world hear wisdom FreeJordanPeterson
2585,Democratic Socialism Socialism
2586,RT MikhailaFuller Wow jordanbpeterson twitter strike No twitter deletes tweet Definitely free speech pl
2587,RT realDailyWire Twitter Suspends Jordan Peterson After He Tweets Ellen Page Just Had Her Breasts Removed https
2588,Why God things happen
2589,Is American government secular
2590,Watch
2591,
2592,What makes West unique flaws achievements
2593,SALE This week visit PragerU store 25 OFF
2594,Chris Elise pro sports photographer He wokeism wrecking sports Hear story
2595,BIG ANNOUNCEMENT We full time house personality thewillwitt amp amalaekpunobi If passionate sharing American values apply amp submit 2 minute video
2596,RT amalaekpunobi Am I Alt Right Reacting To PragerU Hate Unapologetic LIVE
2597,Parents Schools America canceling George Washington founding fathers Learn George Washington country hero latest Leo amp Layla Episode Watch free
2598,The elites live separate set rules amalaekpunobi
2599,God hate evil
2600,You crazy They crazy The progressive left sexual identity issues bulldozer run educational establishment coming house Watch video
2601,What
2602,
2603,This question
2604,Do kids watching Finally trusted network offering fun educational content aligned values Help reach young minds donate today
2605,Chris Elise pro sports photographer He wokeism ruining sports
2606,Israel free speech free press independent courts Its neighbors
2607,It speech protecting
2608,Watch
2609,SethDillon
2610,RT AmiHorowitz One insane videos
2611,RT SethDillon Gmail routing prageru emails spam folder
2612,
2613,Chief Staff opening Work CEO optimizing operations process metrics Join organization shares values To apply visit
2614,RT amalaekpunobi Reacting Roe Wade MELTDOWNS amp My Thoughts Unapologetic LIVE
2615,Is abortion
2616,RT docjimmymyers PARENTS THIS IS A MUST WATCH
2617,The system ethics created
2618,Colleges produce fragile students Watch Olivia Jaber story
2619,Parents CAN SHOULD protect children inappropriate assault WATCH karol present NEW video
2620,A free society free speech
2621,NEW RELEASE Who black woman serve U S Secretary State Parents Teach kids dynamic life Condoleezza Rice educational game show
2622,RT karol Very excited announce prageru video
2623,At age appropriate grammar school teachers discuss issues sex gender students Watch full video
2624,What separates West rest nfergus answer
2625,NEW RELEASE Who decide discuss issues sex gender young children Just decade ago sole purview parents karol
2626,Even atheist agnostic parents owe children educate God Bible
2627,Colleges days AmiHorowitz
2628,Nobody gun UNTIL gun
2629,There freedom revoked matter Watch latest Fireside Chat
2630,She left speechless
2631,Before make mind abortion consider
2632,When slavery George Washington remarkable change heart envisioned country slaves destiny different born Watch
2633,There systemic racism coming media
2634,John F Kennedy lowered taxes opposed abortion supported gun rights believed strong military He proud Democrat
2635,The million dollar question
2636,10 years ago idea reality CEO PragerU Marissa Streit shares story PragerU start latest Stories Us episode
2637,What America left wanted
2638,The government tightens grip economy grows
2639,Liberty Equality Fraternity vs Life Liberty pursuit Happiness What French Revolution wrong Watch full episode
2640,
2641,Does make feel safer
2642,This question
2643,The answer toxic masculinity masculinity masculinity
2644,Government programs supposedly intended women opposite
2645,zubymusic challenging woke narratives fighting truth Watch feature Stories Us
2646,Remember sides wanted strong borders
2647,RARE SIGHTING Common campus
2648,You control outcome control 100 effort
2649,Most leftism avoidance pain Dennis sat TheBabylonBeeWatch
2650,Inflation taxation legislation Milton Friedman
2651,Tyranny creeps small step time amalaekpunobi
2652,Watch
2653,Is abortion
2654,Federalism It feature bug
2655,Spending consequences Inflation
2656,Parents obligation children taught school
2657,Take poll
2658,Freedom religion morphed freedom religion How happen
2659,What Supreme Court ruling amalaekpunobi
2660,They worried change minds silence
2661,RT JillSimonian Good morning CondoleezzaRice Thought enjoy latest prageru kids educational game show featuring YOU W
2662,Do passion guide Make serve
2663,NEW RELEASE Who black woman serve U S Secretary State Parents Teach kids dynamic life Condoleezza Rice educational game show
2664,Parents teach kids original meaning rainbow PragerU Kids JillSimonian
2665,
2666,The Supreme Court struck Roe Wade
2667,It crucial learn history today Watch
2668,Minimum wage laws harm supposedly intended
2669,There freedom revoked matter Watch NEW Fireside Chat
2670,Is offensive Dennis reacts Watch NEW Fireside Chat
2671,Resident Gas prices high Is reduce prices Politicians We cap supply
2672,What Watergate
2673,RT JillSimonian Am I allowed God Promise Twitter
2674,Watch
2675,NEW Fireside Chat
2676,What
2677,RT amalaekpunobi SHOCKER Turns Out Diversity Equity amp Inclusion Don Work Unapologetic LIVE
2678,
2679,Nothing permanent temporary government program Milton Friedman
2680,
2681,Do kids watching Finally trusted network offering fun educational content aligned values Help reach young minds donate today
2682,RT JillSimonian What Good news woke San Francisco return merit based admissions
2683,Capitalism system begins taking giving George Gilder
2684,Parents JillSimonian teaches original meaning rainbow symbolizes PragerU Kids
2685,sagistarbb Sign free
2686,This video TikTok 800 000 views helping promote Kids We appreciate support Sign free
2687,When retreat crime surges That widely agreed
2688,Incentivizing criminals commit crime run police Bold strategy Cotton
2689,The founders religious
2690,The time hear politician call common gun control listen details
2691,No country woven different races backgrounds ethnicities successfully single country America
2692,It surprise Americans losing trust media
2693,Some Americans granted born lower class reach middle upper class Many Brazilians granted
2694,More data equals control It sound science fiction occurring eyes
2695,Freedom value instinct
2696,RT amalaekpunobi Is Our Entire Society Overstimulated Unapologetic LIVE
2697,The moment lose guise civilization things dark WATCH NOW michaeljknowles TheLaurenChen
2698,BIG ANNOUNCEMENT We full time house personality thewillwitt amp amalaekpunobi If passionate sharing American values apply amp submit 2 minute video
2699,No country woven different races backgrounds ethnicities successfully single country America
2700,What kind future destroy past
2701,God butler heaven WATCH
2702,amalaekpunobi
2703,RT amalaekpunobi Apologizing woke mob requires lie
2704,RT TheLaurenChen Gather round folks I pleasure discussing Lord Of The Flies michaeljknowles prageru book cl
2705,Agree disagree
2706,RT amalaekpunobi Gotta love hate mail
2707,To secure liberties understand
2708,If put federal government charge Sahara Desert 5 years shortage sand Milton Friedman WATCH
2709,No nation faces hostility defending
2710,What proper role government
2711,Masculinity celebrated
2712,ESG coming wallet values
2713,RT amalaekpunobi Am I Oppressed Because I Have Black Hair Unapologetic LIVE
2714,If choose live God God lose
2715,Another woke athlete slams amalaekpunobi
2716,RT JillSimonian Remember original age appropriate meaning rainbow PragerU Kids teaches youngest learners Share amp
2717,The book read kids Any guesses
2718,What
2719,NEW Book Club michaeljknowles amp TheLaurenChen WATCH NOW
2720,
2721,Parents decide send children school government A radical idea Hardly
2722,Why push conformity
2723,Religious liberty FIRST Amendment reason
