,Tweet
0,Should transgender receive special government handouts
1,Where rights neighbor begin VolokhC
2,Gun violence multiplies
3,When criminals guns
4,
5,RT JillSimonian My words heart read screen You betrayed american_girl THIS fighting hard
6,RT JillSimonian Never I day american_girl betrayed actual American girls
7,What teachers unions
8,Can pass U S citizen test
9,Does United Nations make world safer
10,The myth voter suppression Georgia debunked
11,What happened
12,Watch latest Fireside Chat
13,The truth feeble minded
14,What FREEST U S state live
15,Do cannabis legal
16,NEW Fireside Chat Who NewsGuard StreitMarissa joins Dennis Watch full episode
17,Great advice jordanbpeterson
18,Dennis joined PragerU CEO StreitMarissa Fireside Chat week discuss ALARMING actions party fact checker NewsGuard You hear
19,RT jordanbpeterson Thanks DennisPrager
20,PragerU Annabella Rockwell joined benshapiro share story
21,There lot pressure NBA players kneel national anthem wear Black Lives Matter T shirt We team meeting early I fellas I gonna put T shirt I gonna kneel
22,Happy holidays merry Christmas
23,Is nuclear energy future
24,When corporate America woke VivekGRamaswamy fought back
25,Advice Happiness happen You seek
26,thecjpearson explains
27,Public libraries Drag queen story hour KirkCameron story hour
28,Boys boys beginning Girls girls start Mister Rogers
29,The ensure ONLY criminals guns Criminalize gun ownership
30,JillSimonian Teach financial literacy gender ideology
31,RT JillSimonian Perhaps financial crisis leaders stuff watch kids TEACH KIDS HOW
32,RT amalaekpunobi I speaking WSU Friday night leftist students responded They posted photos
33,81 years ago attack Pearl Harbor brought United States But America prepared By 1942 U S outproducing Axis powers combined
34,AldoButtazzoni OnTheBrightOne
35,We reliant hostile actors abroad heat homes provide energy
36,December 7 1941 A day lives infamy VDHanson
37,NEW Should transgender receive government handouts San Francisco launched guaranteed income program low income transgender residents payments 1 200 month 18 months AldoButtazzoni asked UC Berkeley students
38,NEW Should transgender receive government handouts San Francisco launched guaranteed income program low income transgender residents payments 1 200 month 18 months AldoButtazzoni asked UC Berkeley students
39,Does make
40,KirkCameron faith based children book He denied 50 public libraries opportunity host children story hour
41,True false Access voting restricted Georgia
42,81 years ago Pearl Harbor attacked
43,Don underestimate importance language
44,On December 7 1941 Japanese Imperial Navy bombed US Naval base Pearl Harbor The surprise attack shocked nation brought world To day remains seared America historical memory VDHanson
45,When Christianity
46,Somehow STILL hearing question access voting Georgia
47,What America left wanted
48,
49,RT Michele_Tafoya Probably damned shame One funniest shows TV And popular
50,Yet SethDillon TheBabylonBee
51,
52,Could The Office made today
53,Even Bono
54,What Take poll
55,RT ZubyMusic Listen Young confused society bombards confusing conflicting messages
56,Learn
57,Teachers unions advocating kids So advocating
58,Would save stranger
59,Watch StreitMarissa full interview ZubyMusic
60,Did PragerU mobile app We rebuilt PragerU ground including brand app Take PragerU videos upgrade experience today It free
61,North Korea communist state South Korea free market country If free enterprise lifts poverty Korean Peninsula
62,It complicated Bailing irresponsible behavior spur irresponsible behavior
63,Do race doctor gender person built bridge drive Of course You competent HMDatMI
64,If jordanbpeterson hateful person You wrong
65,Watch short doc learn
66,Teachers unions prioritize members students
67,RT amalaekpunobi Raw Meat amp Roids Trying To Stomach The Liver King Apology Video Unapologetic LIVE
68,Misinformation defined powerful
69,NEW In 1940 Nazi Germany overran France Britain looked target President Franklin Roosevelt knew prepare America But Arthur Herman senior fellow HudsonInstitute tells amazing story
70,NEW To rescue America Great Depression President Franklin Roosevelt attempted steer country economic course He called plan New Deal Did succeed make matters worse AmityShlaes answers question
71,Gun rights women rights
72,Government solution problem government problem Ronald Reagan
73,NEW In 1940 Nazi Germany overran France Britain looked target President Franklin Roosevelt knew prepare America But Arthur Herman senior fellow HudsonInstitute tells amazing story
74,Which U S state free
75,Alexis Tocqueville Democracy America prophetic
76,NEW To rescue America Great Depression President Franklin Roosevelt attempted steer country economic course He called plan New Deal Did succeed make matters worse AmityShlaes answers question
77,Debunking big switch myth
78,TimBallard combats child exploitation head father encourages parents understand makes predator protect children
79,Is Die Hard Christmas movie
80,The 1 Christmas movie
81,The idea rid And I undermine My credibility effectiveness
82,This gender identity It fair play
83,
84,Socialism nutshell
85,Watch StreitMarissa interview ZubyMusic
86,Beyond level taxation consider theft
87,
88,
89,Are government tax dollars minors medically transition Guess happening
90,
91,The truth havingpower mistrusted James Madison
92,
93,Some states vendetta freedom
94,Has employer made diversity equity inclusion training
95,RT ZubyMusic New interview dropped
96,It YOU
97,The strength democracy lies integrity elections TulsiGabbard
98,PragerU heard
99,To call reforms New Jim Crow deceitful
100,NEW A great gauge society examine tolerated Watch StreitMarissa interview ZubyMusic HERE
101,If USA mandates digital ID
102,NEW Are sending mixed messages ZubyMusic thinks Watch full interview StreitMarissa
103,How SUV ice age
104,Let settle
105,NEW Rapper author actor podcast host entrepreneur ZubyMusic shares pro American viewpoints outspoken personality make constant target woke mob He sits PragerU CEO StreitMarissa discuss free speech
106,Is digital ID step social credit system
107,One small step
108,Keep dump Splash Mountain
109,RT deseretmagazine Conservative religious increasingly nervous especially public But
110,Will Disney CEO woke Disney
111,RT NikkiHaley The teachers unions stop teaching kids victims Stop labels limit potential Let tea
112,Once cynical atheist believer PragerU Director Communications Adrienne Johnson shares powerful journey
113,Teachers Underpaid overpaid
114,If figure stop inflation
115,College students 4 years heard conservative idea
116,NEW Fireside Chat This week Dennis shares important message famous Christmas tunes call time year Watch full episode
117,Spotify corrupt What AldoButtazzoni
118,RT realTanyaTay A FREE documentary Prager agendas teachers unions America If
119,A mental health problem disguised gun problem Rogan
120,RT NeWNetwork Check story mom paying 300 day deprogram daughter liberally indoctrinated
121,RT NikkiHaley The biggest threat fading national pride prageru
122,RT thecjpearson Pray God government
123,RT jasonrantz Insanity What Spotify
124,nypost What
125,Just stop
126,Would 1 4 world
127,America started paving road hell stopped teaching wisdom
128,It different world
129,DID YOU KNOW watch PragerU TV Kick back settle healthy binge watching Help content free tax deductible donation
130,America biggest crisis
131,What America 10 years
132,How stop inflation STOP PRINTING MONEY
133,larryelder
134,Whoever called compound interest greatest force universe encountered white guilt larryelder
135,elonmusk Whose missing
136,elonmusk For saving free speech online give discount
137,elonmusk We
138,RT DefendingEd For parents grandparents concerned citizens If check short documentary prageru
139,amalaekpunobi NEWSMAX ShaunKraisman
140,RT JillSimonian You unsee parents Teacher unions rubber rooms amp paying educators fit classrooms We wi
141,Which trustworthy
142,RT theisabelb DON T FORGET check prageru AMAZING mini doc pulling back curtain Teacher Unions You FLOORED
143,
144,Ok These interesting reactions
145,Default kindness
146,A decade ago word transgender
147,Socialism work DrPhil
148,Don expect build weak pulling strong Calvin Coolidge
149,Liberty lost lost forever John Adams
150,Think hold biblical values If West mistaken
151,It late Act Giving Tuesday gift MATCHED
152,The reason collectivist types hate I number jordanbpeterson
153,From derive morality
154,The number job teachers
155,Donate today gift MATCHED
156,PragerU Annabella Rockwell foxandfriends morning
157,Iran lied nuclear program start currently seeking bomb Ambassador robertcobrienWatch talk StreitMarissa
158,Undoing damage University Can PragerU Annabella Rockwell joined TuckerCarlson night share story
159,Why feminists USA fight Muslim women Iran
160,Deprive entire generation purpose result Timcast
161,The stakes high
162,RT FoxNews DEPROGRAMMED Heiress Annabella Rockwell tells TuckerCarlson woke women college
163,GIVING TUESDAY PragerU videos changing minds millions Americans With videos free ensure reach millions young Americans
164,RT theisabelb I INSIST watch prageru mini doc pulling back curtain teachers unions America I AM SHOCKED https
165,The welfare state welfare masses It egos elites Thomas Sowell
166,Socialism leads economic dictatorship elite
167,Trans athletes Olympics
168,Donate today gift MATCHED
169,A former NBA player
170,If trans players joined WNBA
171,Ban guns
172,Please donate today gift MATCHED
173,Nobody talks secular zealots
174,RT amalaekpunobi The Balenciaga Scandal Gets Even More DISTURBING Unapologetic LIVE
175,DennisPrager Timcast TV
176,RT thecjpearson Activists elonmusk plans provide amnesty suspended Twitter account existentially dangerou
177,Go woke broke
178,RT NikkiHaley The left teachers unions bureaucrats secret weapon protecting kids educat
179,RT JamesSpiro Should You Care Israel excellent video prageru
180,A list actors paid incredible amounts money play dress They ridiculously fortunate And feel guilty HollywoodInToto
181,NEW Anyone protect preserve America protect preserve Israel Ambassador robertcobrien former National Security Advisor Trump administration explains
182,Or forgetting
183,Which big tech company LEAST trust
184,RT Aaronson_David I traveled 75 countries enjoyed time While feel foreign Israel feels
185,Inflation made
186,Clarence Thomas bowed mob
187,Think
188,The reliable news source
189,NEW Anyone protect preserve America protect preserve Israel Ambassador robertcobrien former National Security Advisor Trump administration explains
190,What America biggest crisis benshapiro
191,The pandemic represents rare narrow window opportunity reflect reimagine reset world Klaus Schwab Founder World Economic ForumRed flag pipe dream
192,There reason fleeing droves
193,Truth relative If relative truth
194,Too early Christmas music
195,
196,Preferred pronouns prison MattWalshBlog AbigailShrier
197,
198,The dangerous person world
199,Is TikTok trojan horse
200,Suppressing speech AFTER hits internet late sending Officer Witt catch crimes BEFORE sprout disinformation
201,jordanbpeterson For
202,RT jordanbpeterson How damnable Faculties Education
203,Should ballot harvesting legal
204,Who responsible state public education
205,Why government healthcare
206,Silence presence evil evil Dietrich Bonhoeffer
207,Which free
208,Disinformation eye government administrator
209,Gratitude employed day
210,Sports politicized ClayTravis
211,NEW Short Doc Who responsible state public education Watch full feature HERE
212,25 ENTIRE STORE
213,michaeljknowles StreitMarissa
214,No country rewards hard work United States America
215,How long rename Black Friday
216,Mrs Doubtfire ahead time
217,Watch StreitMarissa jubileemedia
218,The reason collectivist types hate I number jordanbpeterson
219,25 ENTIRE STORE
220,A message today
221,Whose family relate
222,And small candle light thousand light kindled hath shone William Bradford Of Plymouth Plantation
223,What Americans thankful
224,Venezuela disaster A disaster brought socialism This result
225,You politics dinner table
226,Assuming books allowed
227,History books describe present
228,25 ENTIRE STORE
229,Not political
230,Is inflation dictating plans
231,What thankful
232,Ingratitude guarantees unhappiness
233,America 1619 America 1620
234,DO DON T Talk politics Thanksgiving table
235,The Quintessential American HolidayWatch ALL NEW Fireside Chat
236,StreitMarissa michaeljknowles
237,Those loudest
238,nypost Now Americans starting understand inflation
239,RT JillSimonian Just case government refresh HOW MONEY WORKS Made kids leaders managing
240,Define cultural appropriation
241,Are AldoButtazzoni
242,25 ENTIRE STORE
243,Remember CANCEL Thanksgiving
244,The real political debate
245,If college degree produce value pay value neighbor pay
246,RT JennaEllisEsq HT prageru
247,Watch short documentary learn
248,What teachers unions
249,ZubyMusic That
250,RT NikkiHaley When passionate mission tired fighting Had great conversation
251,Inflation Up 25 Americans changing plans due high food travel costs AldoButtazzoni affected
252,Should Americans celebrate Thanksgiving day gratitude Or mourn day guilt MedvedSHOW shares story Thanksgiving
253,Is inflation taking bite Thanksgiving Up 25 Americans changing plans due high food travel costs AldoButtazzoni hits grocery stores LA find handling rising prices holiday season
254,What family Have relationships strained changed
255,Have lost friends political differences
256,That time thewillwitt spread Thanksgiving spirit weird
257,The problem American honesty loyalty honor patriotism live Constitution Frederick Douglass
258,What heck happened late night comedy
259,25 ENTIRE STORE
260,North Korea communist state South Korea free market country If free enterprise lifts poverty Korean Peninsula
261,How American schools teach gender ideology financial literacy
262,The reliable news source
263,What assault rifle
264,NEW RELEASE In culture diet exercise fads healthy Renowned fitness expert VinnieTortorich offers key behaviors repeated stay shape Anyone
265,Is Die Hard Christmas movie
266,Happy Thanksgiving Die Hard Christmas movie
267,RT amalaekpunobi Dear Balenciaga WHO Okayed This Unapologetic LIVE
268,America fat Watch fitness expert VinnieTortorich present latest 5 Minute video
269,Government ultimate monopoly
270,
271,RT andrewnuity NEW In culture diet exercise fads healthy Renowned fitness expert
272,RT VinnieTortorich Thank prageru helping spread word health NSNG
273,
274,There case made esteem movement ended harm MattWalshBlog
275,Watch NEW Short Documentary
276,NEW In culture diet exercise fads healthy Renowned fitness expert VinnieTortorich offers key behaviors repeated stay shape Anyone
277,What happened Disney
278,Suppressing masculinity produce strong physically OR morally jordanbpeterson
279,Entitlements condition selfishness Hence
280,If clean amp sustainable nuclear energy
281,Watch short doc find public education failing America
282,The biggest bully school Teachers unions
283,The reason collectivist types hate I number jordanbpeterson
284,Devotion truth hallmark morality
285,Comedy legal Twitter Elon Musk
286,Should Elon buy META
287,What homelessness
288,Do walls work
289,It racist ALL racist
290,Twitter quickly freest social media platform pro censorship crowd CAN T STAND IT ironically Twitter voice complaints
291,What parents teachers unions
292,White wokeness driven guilt wil_da_beast630
293,Throughout history tyranny default Self rule freedom exception
294,Ballot harvesting parties collect deliver ballots
295,What happen trans players joined WNBA
296,Learning things college school Right thecjpearson
297,StreitMarissa asked Dr Jessica Hochman irreversible damage caused gender affirming clinics
298,The reason collectivist types hate I number jordanbpeterson
299,When Christianity
300,Twitter verification process
301,Even atheist amp agnostic parents owe children educate God Bible
302,RT jordanbpeterson Let prageru advertise Twitter Reinstate Trump Consign anonymous narcissists psychopaths troll hell
303,Watch full episode
304,A Pediatrician Advice Parenting Age Woke StreitMarissa interviews Dr Jessica Hochman
305,For jordanbpeterson hateful person
306,Is open transparent Twitter vital preserving free speech America
307,elonmusk Some changes taking place Twitter promising We happy friends jordanbpeterson amp TheBabylonBee reinstated That banned advertising explanation love advertise Twitter
308,Wokeness basically make comedy illegal Elon Musk
309,TheBabylonBee
310,RT TheBabylonBee We back Let sink
311,Comedy legal Twitter SethDillon TheBabylonBee
312,Teachers unions advance left wing Not students
313,NEW With social media politics permeating medicine push transgenderism kids harder parents raise children Dr Jessica Hochman pediatrician mother She sits PragerU CEO StreitMarissa
314,AldoButtazzoni
315,Watch latest Fireside Chat Dennis reacts trans beauty pageant winner
316,What heck happened late night comedy
317,NEW Short Doc Who responsible state public education Watch full feature HERE
318,Teachers unions Watch NEW Short Documentary
319,Free speech Coming social media platform
320,Everyone Is SICK These Woke Hollywood Tropes Nerdrotics Watch
321,Is Twitter worse elonmusk
322,RT realDailyWire JeremyDBoreing The Master Program PragerU coming DailyWire December DennisPr
323,Uncensored047 Hey JeremyDBoreing room block elonmusk
324,Where move Twitter HQ
325,
326,NEW Fireside Chat A Transgender Beauty Pageant Winner Watch full episode
327,ESG proponent Klaus Schwab chairman World Economic Forum puts We continue economic system driven selfish values short term profit The message clear ESG save
328,RT JillSimonian The Biggest Bully In School Parents duped MUST WATCH hosted KaliFontanilla
329,What teachers unions KaliFontanilla investigates intentioned teachers unions biggest bully school
330,
331,RT XAVIAERD I spent 23 years Liberal I dozens debates Conservatives NEVER ONCE felt silenced belittled I becam
332,The country RIGHT exist Jewish country
333,Watch ALL NEW Short Doc JillSimonian
334,The strength democracy lies integrity elections
335,Is college worth price
336,MattWalshBlog AbigailShrier
337,Watch NEW Mini Doc The Biggest Bully School Why Public Education Is Failing America
338,How telling truth
339,Wokeness killing Hollywood Nerdrotics amalaekpunobi
340,What strengthen trust America elections process
341,thecjpearson Which party founded KKK
342,RT JillSimonian Dropping tomorrow In case watch NEAToday AFTunion rweingarten usedgov p
343,RT amalaekpunobi Hot Tea LGBT KAREN JoJo Siwa vs Candace Cameron Bure Unapologetic LIVE
344,Trans players WNBA Matt_Barnes22
345,Parents show kids NEW Around World episode Egypt
346,Do agree
347,White backseat amalaekpunobi
348,Do ballot harvesting undermines election integrity
349,What needed Twitter 2 0
350,Alexis Tocqueville Democracy America prophetic Pete4CA amp michaeljknowles walk Watch
351,The road world paved wisdom intentions
352,You decide lanheechen
353,Is Canadian healthcare model In Ontario country biggest province healthcare costs 46 entire budget 2010 By 2030 projected 80 In words years Ontario money pay EXCEPT healthcare
354,RT Nerdrotics Had great conversation amalaekpunobifrom Unapologetic prageru Marvel Disney amp Hollywood Are DEAD Woken
355,Sorry truth relative
356,Why Palestinian state Here DavidBrog explains
357,What NATO
358,Watch full episode
359,RT JillSimonian The 3 C Classic Literature Civics amp Cash Course financial literacy
360,Do trust mail ballots
361,NEW Alexis Tocqueville aback America deep religious roots He recorded observations Democracy America Pete4CA amp michaeljknowles discuss learn
362,A single 5 Minute PragerU Video undo 4 years college indoctrination
363,This degrading MattWalshBlog AbigailShrier
364,Do agree
365,What part high school curriculum
366,NEW Could predicted future America 200 years ago Alexis Tocqueville foresaw society fraught materialism soft despotism classic study governance Pete4CA amp michaeljknowles discuss learn
367,The Bible ultimate source morality
368,1 All created equal 2 Certain basic rights exist independent government 3 Government exists protect rights benshapiro reminds revolutionary ideas
369,RT amalaekpunobi Another FAILED Attack Dennis Prager The Young Turks Unapologetic LIVE
370,NEW Which branch government powerful sherifgirgis
371,Turns ID vote thecjpearson
372,Dennis responds assertion Jews control Hollywood
373,Intimidation harassment blackmail norm American politics
374,Schools educate indoctrinate
375,The system ethics created
376,TheOfficerTatum amalaekpunobi
377,Is digital ID step social credit system
378,NEW The Supreme Court final controversial issue But Framers Constitution intended sherifgirgis Associate Professor Law University Notre Dame answer
379,If poor love capitalism It lifted billions poverty
380,PragerU Gala 2022 StreitMarissa jordanbpeterson
381,Coming
382,
383,DP JP Is duo Last night PragerU 2022 Gala jordanbpeterson DennisPrager
384,What greatest threat free fair elections America
385,AldoButtazzoni debate ideas
386,Socialism work Dr Phil
387,If America racist ethnic racial backgrounds world fight hard move
388,The strength democracy lies integrity elections TulsiGabbard
389,NikkiHaley amp StreitMarissa discuss importance putting family
390,Tolerance street left
391,Not democracy A republic
392,RT DrJayRichards Jordan Peterson evil exists surely opposite evil exists At prageru gala
393,1 Restrict ability produce electricity 2 Mandate EV 3 Ask public plug EV vulnerable grid AlexEpstein
394,Make America _______ fill blank
395,ZubyMusic amalaekpunobi
396,Should allowed compete Miss America pageants thecjpearson thoughts
397,Watch latest Fireside Chat Is Your Race Your Identity
398,
399,Is media paying attention diesel shortage
400,Think hold biblical values If West mistaken
401,What Veterans Day everyday Americans AldoButtazzoni
402,The U S armed forces receive Nobel Peace Prize
403,amalaekpunobi recounts passive aggressive protest witnessed Watch
404,RT thecjpearson The Miss America Organization crowned biologically male queen At rate female President
405,Reality check
406,RT AlexEpstein The US experiencing dangerous shortage diesel fuel Blame anti fossil fuel politicians Prevented
407,This national loathing killing Ambassador NikkiHaley explains StreitMarissa ALL NEW episode Real Talk
408,Ambassador NikkiHaley remarkable career Gov SC U S Ambassador UN She sits PragerU CEO StreitMarissa discuss service America finds strength Watch
409,Comedy destroyed humor TheDavidZucker
410,RT FAIRImmigration What Veterans Day everyday Americans California spends money illegal immigrants vetera
411,RT AldoButtazzoni If check video I talk students UCLA Veterans Day
412,Free enterprise freedom speech freedom assembly freedom religion makes nation fair
413,What world U S military
414,They saved free world And job preserving peace When making world secure place decent group deserves bulk credit PeteHegseth
415,Prioritize veterans They deserve AldoButtazzoni makes case
416,
417,Can warn thecjpearson explains
418,RT AXELKAISER Listo LA California grabación sesiones prageru
419,Watch full episode
420,NEW Fireside Chat Is Your Race Your Identity Dennis reacts anti racist book middle schoolers questions society current obsession skin color
421,Watch Women Aren Naturally Leaders Fact Misogyny ZubyMusic
422,Those fight real evil fight statues Dennis Prager
423,AldoButtazzoni UCLA students
424,Spend illegal immigrants veterans Do agree
425,When cheapen language
426,RT thecjpearson Remember Left flee America President office Those
427,Coming
428,The Democratic Party defended slavery started Civil War founded KKK fought major civil rights act U S history
429,Inflation effect hidden tax The money saved robbed part purchasing power quietly transferred government issues money Thomas Sowell
430,Parents This STOP sexualization children
431,Which party founded KKK
432,Election day carry different meaning
433,Step 1 promise benefits Step 2 attract millions foreigners benefits Step 3 efforts control entry Step 4 grant citizenship vote Step 5 WIN EVERY ELECTION TuckerCarlson
434,The fact liberals valued liberty free speech vote great suppressor liberty Left tragedy time DennisPrager
435,Texas California
436,RT thecjpearson I excited announce I joined PragerU team personality content creator There organ
437,NEW What Veterans Day everyday Americans AldoButtazzoni UCLA honoring veterans Watch
438,Watch Reacting rustyrockets amp jordanbpeterson Heated Debate amalaekpunobi
439,Don teenagers borrow credit card watch episode Cash Course debt works Middle high school students learn financial debt properly advantage opposite
440,The strength democracy lies integrity elections
441,Knives homicides rifles Should ban
442,If decide soft crime reap sow
443,
444,Twitter worse
445,Freedom generation away extinction We pass children bloodstream It fought protected handed Ronald Reagan
446,It groceries suddenly valuable It money valuable
447,This obvious For reason
448,Did experience problems voting
449,How long opinion announce valid election results
450,Why ID
451,The Elites Have Lost Twitter They LOSING IT ft ZubyMusic Watch
452,DennisPrager talks TheBabylonBee Deuteronomy Jewish Space Lasers The_Kyle_Mann Watch
453,RT JillSimonian Infotainment Great talk KIDS ElishaKrauss prageru
454,NEW Writer director producer TheDavidZucker comedy classic Airplane horror parody Scary Movie franchise wanted make laugh But comedy destroyed humor Watch
455,Policy makers left treat criminals victims police officers criminals
456,RT ElishaKrauss About join gal JillSimonian prageru live
457,
458,
459,If progressive policies work fleeing blue states mass
460,If life government fix Only
461,Are cities breaking point Have
