,Tweet
1852,realbassemeid Israel Uses Rockets Defend Its People Hamas Uses People Defend Its Rockets
1853,RT realbassemeid Several children injured misfired PIJ rockets weekend transferred Israeli hospitals fo
1854,What Can trust NYT
1855,Reuters Or
1856,Learn
1857,Cancel culture stifles creativity
1858,Why I sued daughter woke school
1859,It DOUBLE MATCH week PragerU If content making reach Make tax deductible donation HERE
1860,If Washington sword American Revolution Jefferson pen Adams engine
1861,Moral chaos result
1862,Sorry truth relative
1863,Political correctness killing human interaction
1864,Environmentalists tout nuclear energy clean alternative fossil fuels What happened
1865,What free college
1866,Using wrong pronoun office fired In Canada land court
1867,Get woke broke
1868,Watch ALL NEW Fireside Chat
1869,Although I paid price I regret standing Renowned Broadway actor cliftonaduncan lost career due mandates amalaekpunobi reacts
1870,Marx wrong fraud
1871,You I capable trustworthy handle firearm We prepare OWN responders To protect loved
1872,Labeling opinions hate speech attempt circumvent First Amendment
1873,Is liberty nature Watch ALL NEW Fireside Chat
1874,WATCH How Affirmative Action Actually HARMS Minorities amalaekpunobi
1875,Learn
1876,Did France 70 electricity nuclear energy
1877,DailyCaller
1878,RT DailyCaller Teacher I 180 days turn revolutionaries
1879,It DOUBLE MATCH week PragerU If content making reach Make tax deductible donation HERE
1880,Intersectionality hierarchy victimization
1881,How high minimum wage
1882,How stop
1883,The left sexual identity issues wrecking ball traditional values
1884,While technology improve human nature
1885,What
1886,Discipline path freedom
1887,Which worse single king million unelected anonymous kings bureaucrats America avoided former GW saddled latter
1888,
1889,I failed I found 10 000 ways work Thomas Edison
1890,Why push conformity
1891,RT TPostMillennial Senior Policy Analyst Inez Stepman InezFeltscher talks student loan forgiveness scam It hard imagine
1892,RT JillSimonian Pencils Remember schools taught values hard work responsibility taking tests encourage kids
1893,REACTION Uncomfortable Conversations Black Man Part 2 amalaekpunobi
1894,When character historical figure mind
1895,
1896,The homeless policy environment permissive
1897,Can inmates anymore Now incarcerated persons
1898,Intimidation harassment blackmail norm American politics Why Because works
1899,When transparency means tyranny
1900,If idea studying test makes hide rock worry In episode give 3 tips prepare test
1901,Why God things happen
1902,To secure liberties understand
1903,
1904,Question proponents 15 minimum wage higher
1905,America opportunity nations country world history
1906,Would stricter gun laws reduce gun violence
1907,Inflation money chases goods Pop quiz effect printing money inflation
1908,Make cancellable
1909,Does sound utopia
1910,Liberty meaningless utter thoughts opinions ceased exist Frederick Douglass
1911,Focusing recipe misery
1912,The present beneficiary accumulated intellectual scientific contributions past
1913,WATCH amalaekpunobi Asking Strangers ANONYMOUS Political Takes
1914,Help spread ideas PragerU generation PragerU charitable profit August fundraising month Please today tax deductible donation Hurry donations week MATCHED
1915,Education broken Watch StreitMarissa show path forward
1916,ZubyMusic
1917,Personal responsibility You responsible 1 Your actions2 Your words3 Improving 1 2
1918,Hear StreitMarissa full story
1919,As educator StreitMarissa quickly learned firsthand education system promoted low academic standards undermining American values She decided part solution This story
1920,How reclaim educational system 1 Advocate academic transparency 2 Speak Express concerns 3 Take active role child education
1921,Why I sued daughter woke school
1922,Americans generous They spirit generosity advantage
1923,It speech protecting
1924,No nation faces hostility defending
1925,Not trick question
1926,The bigger government smaller citizen
1927,The myth debunked
1928,
1929,What nation controlled thousands kings supreme specialized fiefdoms vast power life king Good question
1930,RT InezFeltscher Student loan forgiveness robs working class pay woke managerial types Universities benefited enormously
1931,RT InezFeltscher Student loan forgiveness payout woke managerial class Dems constituency Pure simple
1932,Former Leftist NAILS Why The Left Is So Angry amalaekpunobi
1933,RT kelseybolar Do favor learn watching InezFeltscher
1934,RT IWF WATCH Independent Women Forum prageru joined voices release video The Student Loan Forgiveness Scam featuri
1935,Government inaction underrated virtue
1936,How explain
1937,OUT NOW It hard imagine screw higher education IWF InezFeltscher Watch
1938,Help spread ideas PragerU generation PragerU charitable profit August fundraising month Please today tax deductible donation Hurry donations week MATCHED
1939,Be mindful habits developing
1940,Israel free speech free press independent courts Its neighbors
1941,From wealth opportunity food lines This socialism worked Venezuela
1942,RT IWF MUST WATCH InezFeltscher joined prageru breakdown student loan forgiveness scam
1943,Don question religion green Just faith
1944,The left stomach diversity
1945,The answer toxic masculinity masculinity masculinity
1946,NEW RELEASE It hard imagine screw higher education make sweeping student loan forgiveness reality Ask benefits IWF
1947,Freedom control There
1948,He draws line information disinformation power program reality
1949,Perspective
1950,Minimum wage laws harm supposedly intended
1951,Typical
1952,The trend
1953,Wow
1954,Just offended Ricky Gervais
1955,Israelis Palestinians Who More Tolerant AmiHorowitz
1956,Is America great
1957,Help spread ideas PragerU generation PragerU profit charitable organization August fundraising month 100 tax deductible donation production marketing videos
1958,If planet There energy source It wind solar It nuclear energy
1959,Socialism track record AndyPuzder
1960,Sad realbassemeid
1961,CRT holds defining characteristic race Not behavior values character
1962,Science deny existence God Science greatest advocate
1963,If taught wisdom chance wise If chance fool And foolish great deal harm
1964,I believe atheism plausible theologies It contrary possible The idea universe existed created I talk violation human rationality Charles Krauthammer
1965,Are offended
1966,Defunding police reckless idea
1967,Help spread ideas PragerU generation PragerU profit charitable organization August fundraising month 100 tax deductible donation production marketing videos
1968,Reality satire SethDillon
1969,Stop Sexualizing Our Kids Children minds attack From kindergarten high school kids exposed early sexualization Tell media educational institutions stop sexualizing children Sign petition
1970,
1971,James Lindsay
1972,Believing takes faith believing God
1973,NEW RELEASE Jerome Eisenberg standing filing lawsuit hold daughter school accountable He sat StreitMarissa honest conversation regressive direction education minded parents turn tide
1974,RT amalaekpunobi Why Was 90s TV So Much More Wholesome Unapologetic LIVE
1975,American privilege real If born skin color lottery
1976,Powers scope national government left states This framers envisioned
1977,Help spread ideas PragerU generation PragerU profit charitable organization August fundraising month 100 tax deductible donation production marketing videos
1978,RT prageru Watch fireside chat
1979,What
1980,AmiHorowitz interviews Palestinian Imam gripping short doc Watch rest HERE
1981,RT HollywoodInToto Wasn I I learned I canAm LA prageru video shoot So excit
1982,Justice blind Social justice agenda
1983,Sending child college akin playing Russian roulette values
1984,Success dependent skin color
1985,NEW RELEASE Jerome Eisenberg standing filing lawsuit hold daughter school accountable He sat StreitMarissa honest conversation regressive direction education minded parents turn tide
1986,Why electric bill high
1987,Anti Semitism canary coal
1988,Watch fireside chat
1989,How hard obtain ID
1990,Common Sense Is Not So CommonWatch fireside chat HERE
1991,Learn Coolidge
1992,President Calvin Coolidge cut taxes vetoed bills unpopular shrank size government He left federal budget lower found Could Calvin Coolidge elected today
1993,Watch amalaekpunobi strangers America racist
1994,Reminder
1995,Help reach videos August fundraising month StreitMarissaDonate today
1996,If printing money make nation rich Argentina Venezuela Zimbabwe richest nations world
1997,Is saddle future generations massive debt
1998,RT Caitlyn_Jenner prageru Great question obvious answer charliekirk11 prageru great breakdown analysis
1999,Take responsibility life
2000,How genders
2001,Religion tells children imperfect work Secularism tells children perfect work
2002,When retreat crime surges That widely agreed
2003,
2004,
2005,Tell
2006,Learn
2007,Most importantly If college pause REALLY college waste time money
2008,Advice young considering college If college goal plan achieve Your college journey cost parents boatload money What return Choose courses practical mindset
2009,REACTING Viral TikToks w HRH Collection amalaekpunobi HRHCOLLECTION Don miss
2010,A society children honor parents doomed destruction
2011,I remain committed faith desire love based belief system sexuality
2012,What
2013,Less police More crime
2014,Moral chaos result
2015,The writer popular influential history book modern history radical leftist professor despised subject This explains lot
2016,Israelis Palestinians Who More Tolerant AmiHorowitz investigates
2017,
2018,
2019,RT JillSimonian With school districts lowering standards make families feel reaching basic academic benchma
2020,Going green cost environmental cost
2021,Are cops perfect Of course And expect But single day difficult conditions police protect guys
2022,For transporting oil gas pipelines safest bet Think move Trains move Trucks move Pipelines
2023,The left stomach diversity
2024,Are humans valuable animals
2025,Today Dennis Prager birthday Last chance sign card send nice message
2026,The left sells victimhood exchange power
2027,What growing Dennis Prager father His David shares Today Dennis birthday Make donation PragerU honor Dennis Prager big day world
2028,The loss freedom happen overnight The Chinese Social Credit System decades making
2029,Sign Dennis Prager Birthday Card
2030,Gun control advocates stop lives SAVED firearms
2031,This Man Story PERFECTLY Exposes Our Upside WorldWatch amalaekpunobi react
2032,Watch
2033,Checking How criminal justice reform working
2034,Get politics sports
2035,Look It Dennis Prager birthday Send Dennis birthday message link make sees
2036,Do kids watching mobile devices Finally trusted network offering fun educational content aligned values Check young minds grades K 12
2037,If claims victim hear real victims
2038,RT prageru What Dennis birthday
2039,So societal scale intentions absent wisdom lead evil actions
2040,When hard work meritocracy racist conservmillen
2041,It important kill bill pass President Calvin Coolidge
2042,The future women sports
2043,What Dennis birthday
2044,The answer
2045,Are born
2046,Oil powers 97 global transportation
2047,Exactly Watch latest fireside chat HERE
2048,amalaekpunobi reacts popular leftist Instagram account
2049,What
2050,Me What woman Dictionary I biologist
2051,Are person intentions Many lot problems belief In fact source evil world Dennis Prager explains
2052,Closing pipelines consequences
2053,He
2054,Dennis tells RubinReport birthday
2055,If asked explain Electoral College
2056,I favor fairness I favor freedom Milton Friedman
2057,Watering standards harms students
2058,True
2059,NEW RELEASE Are person intentions Many lot problems belief In fact source evil world Dennis Prager explains
2060,If nationalized health systems superior countries nationalized health America medical procedures
2061,Masculinity celebrated
2062,Make cancellable
2063,How criminal justice reform working
2064,The fastest society lose freedom granted
2065,Many attempts redistributing wealth ended redistributing poverty Thomas Sowell
2066,Don miss NEW series Around World JillSimonian
2067,The time hear politician call common gun control listen details
2068,Become PragerUnited member today Join PragerU monthly giving club thousands fellow donors committed keeping PragerU videos free changing millions young minds Will join
2069,Before make mind abortion consider
2070,If choose live God God lose
2071,Police Good Bad
2072,Government swelling office Sometimes faster slower Is EVER BIG ENOUGH
2073,Parents We digital kids magazine President Ford Many Americans appreciate time recognize Ford helped heal Nation divisions Use resource teach kids Presidents
2074,No government voluntarily reduces size President Ronald Reagan
2075,Look birthday coming Send Dennis birthday message link make sees
2076,Are offended
2077,After 5 TRILLION govt investments Fossil fuels provide 84 world energy Oil powers 97 transportation
2078,The trend
2079,Which party founded KKK
2080,A colossal mistake If WWI WWII
2081,
2082,Parents We digital kids magazine President Ford Many Americans appreciate time recognize Ford helped heal Nation divisions Use resource teach kids Presidents
2083,
2084,Rather working find cure biological cancer investor entrepreneur biotech CEO Vivek Ramaswamy fighting cultural cancer wokeism corporate America
2085,Suppressing speech AFTER hits internet late sending Officer Witt catch crimes BEFORE sprout disinformation
2086,I offended debate equivalent flipping board game start losing
2087,Is America great
2088,
2089,Intersectionality hierarchy victimization
2090,Israelis Palestinians Who More Tolerant Watch rest
2091,Wish Dennis Happy Birthday
2092,Agree disagree There case made esteem movement ended harm
2093,amalaekpunobi takes streets America racist WATCH HERE
2094,Are humans valuable animals
2095,ESG coming wallet values
2096,Parents decide send children school government A radical idea Hardly
2097,Government inaction underrated virtue Watch NEW 5 Minute Video
2098,Devotion truth hallmark morality Ayn Rand
2099,RT amalaekpunobi Taylor Swift Pollution Will Smith Awkward Apology amp What Is Recession Unapologetic LIVE
2100,Unnecessary medical gender transition irreversible damage
2101,WE RE HIRING Director Marketing Kids Content To learn apply visit
2102,Look birthday coming Send Dennis birthday message link make sees
2103,Freedom away away sheer ignorance
2104,This question
2105,What caused Civil War Did South secede slavery
2106,Be mindful habits developing
2107,Who tolerant This amihorowitz watch
2108,Show Dennis love Sign birthday card personal note
2109,Become PragerUnited member today Join PragerU monthly giving club thousands fellow donors committed keeping PragerU videos free changing millions young minds Will join
2110,A vegan baby
2111,Watch ALL NEW Fireside Chat
2112,Did The Watergate break significant part scandal
2113,Don question religion green Just faith
2114,It weapon It weapon Watch NEW Fireside Chat
2115,Watch amalaekpunobi talk plan build futuristic glass city Saudi Arabia Does sound dystopian nightmare interested living
2116,Even believe God wish
2117,Parents PBS kid PragerU providing alternative JillSimonian
2118,A recession quarters row negative growth President Bill Clinton
2119,Watch
2120,There 193 countries United Nations today Of singled especially egregious offender organization mandate preserve enhance human freedom tolerance
2121,RT JillSimonian Perhaps teacher unions school boards amp DOJ watch latest PragerU Kids video guidance make
2122,Do recession
2123,Show Dennis love Sign birthday card
2124,Do pass Israel test
2125,Look birthday coming Send Dennis birthday message link make sees
2126,WE RE HIRING There number open positions available including Director Marketing Kids Content Motion Graphic Designer Creative Conceptor WriterTo learn apply visit
2127,RT JTLonsdale We partnered PragerU release documentary Homelessness Reality Solution Check hereh
2128,
2129,More data control
2130,There freedom revoked matter
2131,NEW Do admit wrong forgiveness Apologizing step making things damaged friendship hurt In episode give 5 tips apologize
2132,RT amalaekpunobi Do Reality Shows Have Fat Acceptance Problem Unapologetic LIVE
2133,Inflation made phenomenon
2134,RT JillSimonian DITTO Lenient public school standards leave students unprepared sfexaminer
2135,RT AmityShlaes Calvin Coolidge format
2136,RT JillSimonian Remember learning President James Polk school contributions amp accomplishments America ME NEITHER
2137,Gun confiscation ends
2138,AmiHorowitz interviews Palestinian Imam gripping short doc Watch rest HERE
2139,What Parents Don show video book kids
2140,What America biggest crisis
2141,Chris Elise pro sports photographer He speaking current woke athlete complex You hear story
2142,Nothing permanent temporary government program Milton Friedman
2143,Does outfit offend
2144,The discipline desire background character John Locke
2145,Colleges days
2146,amalaekpunobi debunks Ibram Kendi premise Anti Racism Watch
2147,Think hold biblical values If West mistaken
2148,Defunding police reckless idea
2149,TikTok Cook APOLOGIZES Cowboy Caviar Cultural Appropriation amalaekpunobi
2150,You heard stock market crash bank runs Hoovervilles Is fair blame President Herbert Hoover Great Depression KenWhyte3 examines evidence
2151,Do adult form legal ID
2152,Disinformation eye government administrator
2153,Sign Dennis Prager Birthday Card
2154,Myth The left cares guy
2155,Do kids watching Finally trusted network offering fun educational content aligned values Help reach young minds donate today
2156,Democratic Socialism Socialism
2157,Nobody invented capitalism It free naturally exchange goods services benefit
2158,Would JFK conservative today WATCH
2159,NEW RELEASE TimBallard trained C I A runs Operation Underground Railroad largest anti trafficking organizations world Hear story
2160,Top Cities Home Buyers Seeking Leave 1 San Francisco 2 Los Angeles 3 New York4 Washington D C 5 Seattle6 Boston7 Detroit8 Denver9 Chicago 10 Minneapolis Data published real estate firm RedfinAny guesses cities common
2161,PragerU CEO Marissa Streit made PragerU fastest growing conservative organization world
2162,Communism responsible civilian deaths 1 million Vietnam1 million Eastern Europe1 5 million Ethiopia2 million North Korea2 million Cambodia20 million Soviet Union65 million China
2163,While appalling book Marxism calls teachers lead revolution
2164,It character race
2165,RT amalaekpunobi Keke Palmer Colorism Gender Nonconforming KIDS amp Woke Military Unapologetic LIVE
2166,What President James Polk Parents put kids test Guess Mess
2167,If history teach private property inextricably linked civilization Ludwig Von Mises
2168,NEW RELEASE Herbert Hoover succeeded Yet remembered failure Great Depression Is legacy justified Historian KenWhyte3 examines evidence
2169,OUT NOW Herbert Hoover blamed causing Great Depression legacy fair KenWhyte3 examines evidence Watch
2170,NEW RELEASE Americans place enormous pressure presidents But President Coolidge shrink government The result America economy boomed Could elected today AmityShlaesWATCH NOW
2171,OUT NOW Watch AmityShlaes present NEW 5 Minute Video President probably
2172,NEW RELEASE Learn appreciated President NEW 5 Minute Video presented AmityShlaes Watch
2173,OUT NOW Watch AmityShlaes present NEW 5 Minute Video appreciated President
2174,Become PragerUnited member today Join PragerU monthly giving club thousands fellow donors committed keeping PragerU videos free changing millions young minds Will join
2175,Government swelling office Sometimes faster slower Is EVER BIG ENOUGH
2176,Become PragerUnited member today Join PragerU monthly giving club thousands fellow donors committed keeping PragerU videos free changing millions young minds Will join
2177,NEW RELEASE Herbert Hoover succeeded Yet remembered failure Great Depression Is legacy justified Historian Kenneth Whyte examines evidence KenWhyte3
2178,NEW RELEASE Americans place enormous pressure presidents But President Calvin Coolidge shrink government The result America economy boomed Could elected today AmityShlaes
2179,NEW RELEASE Warren Harding remembered scandals accomplishments But harsh appraisal fair Renowned historian AmityShlaes takes fresh 29th president
2180,How explain
2181,Clarence Thomas bowed mob
2182,Is Halloween costume offensive
2183,The British Empire great power abolish slave trade slavery modern world
2184,We government health Just opposite We government
2185,The Closing American Mind From Bach TikTokWatch rest episode
2186,Would stricter gun laws reduce gun violence
2187,Socialism nutshell
2188,Don send kids public school expect turn fine KaliFontanilla
2189,Is American government secular
2190,Everyone live expense state They forget state lives expense Frédéric Bastiat
2191,Covid lockdowns direct assault small businesses secret America economic engine
2192,If
2193,Is saddle future generations massive debt
2194,The Bible teaches children effectively book center universe
2195,After U S pulled Paris Climate Accord led world reducing carbon emissions However EU released additional 40 million CO2 year China released 120 million additional Big government answer
2196,Me What woman Dictionary I biologist amalaekpunobi
2197,The bigger government smaller citizen
2198,Would Walt Disney recognize company today
2199,Stay lane Chevy amalaekpunobi
2200,
2201,Intersectionality hierarchy victimization
2202,
2203,If Washington sword American Revolution Jefferson pen Adams engine
2204,Because fine time American
2205,What President James Polk Parents put kids test Guess Mess
2206,Parents Sometimes chosen job big begin doubt takes lot faith believe chosen reason In episode travel back time meet Gideon learn value faith trust
2207,LegendaryEnergy Is life
2208,RT amalaekpunobi I Saw Jordan Peele Nope Was It Woke Unapologetic LIVE
2209,How Big Government Hurts Small Business
2210,Inflation taxation legislation Milton Friedman
2211,What Parents Don show video book kids
2212,
2213,Children grow dad 5 times live poverty commit crime 9 times drop school 20 times prisonFathers matter larryelder
2214,Well RealBenCarson
2215,The left losing term groomers Watch
2216,RT JillSimonian If educating students countries prosperity socialism day day realities socialism
2217,There progressive bread lines progressive socialism
2218,In secular world opinions morality If God objective morality
2219,
2220,Do kids watching mobile devices Finally trusted network offering fun educational content aligned values Check young minds grades K 12
2221,If fled country leave politics border
2222,What lie joke play tricks Lying wrong trouble harm Parents famous fable Aesop teaches importance honest times
2223,Watch NEW Fireside Chat OUT NOW
2224,Don miss NEW series Around World JillSimonian
2225,Watch NEW Fireside Chat
2226,Should date different political beliefs amalaekpunobi
2227,Political language designed make lies sound truthful murder respectable give appearance solidity pure wind George Orwell
2228,Is abortion
2229,
2230,Conservatism focuses serving theories
2231,RT JillSimonian If talking kids REALITIES countries prosperity socialism socialism
2232,The federal government powers enumerated means power specifically delegated Constitution All powers left states
2233,The government lost poverty long ago Time rethink strategy
2234,Who tolerant
2235,Do kids watching mobile devices Finally trusted network offering fun educational content aligned values Check young minds grades K 12
2236,Alexander Hamilton
2237,Israel free speech free press independent courts Its neighbors
2238,What
2239,Cancel culture rea
2240,OUT NOW Discover socialist policies brought thriving country South America Watch Around World Venezuela
2241,RT amalaekpunobi REACTION Uncomfortable Conversations w A Black Man Unapologetic LIVE
2242,RT michaeljknowles TikTok owned avowed enemy American barbarize souls find evil things catc
2243,Without freedom lost
2244,RT JillSimonian One priority especially CA amp laschools continue fail meet standard academic benchm
2245,Learn
2246,Communism responsible civilian deaths 1 million Vietnam1 million Eastern Europe1 5 million Ethiopia2 million North Korea2 million Cambodia20 million Soviet Union65 million China
2247,Is Halloween costume offensive thewillwitt
2248,Focusing recipe misery
2249,Socialism destroyed beautiful nation Venezuela In episode Around World based PragerU Kids magazines discover socialist policies brought thriving country South America
2250,RT JillSimonian Perhaps leaders missed lesson honesty kids save America raise kids share
2251,What
2252,What world U S military
2253,Watch brand episode The Book Club michaeljknowles maxeden99
2254,Electric cars coal powered cars Americans afford
2255,Do kids watching Finally trusted network offering fun educational content aligned values Help reach young minds donate today
2256,Take responsibility life
2257,Catch amalaekpunobi unfiltered interview HRHCOLLECTION
2258,Watch
2259,Every black representative House 1935 Republican Every black senator 1979 Republican First female member Congress Republican First Hispanic governor senator Republicans The Asian Senator Republican
2260,Look source society collapse find word inflation
2261,Get woke broke
2262,There case made esteem movement ended harm
2263,OUT NOW Watch Book Club michaeljknowles amp maxeden99
2264,GovMikeHuckabee
2265,How reclaim educational system KaliFontanilla 1 Advocate academic transparency 2 Speak Express concerns 3 Take active role child education
2266,
2267,COMING TOMORROW Discover life exceptional America compared countries Watch special preview Around World Venezuela
