,Tweet
937,Parents Teach kids Andrew Carnegie immigrant worked hard eventually richest America He gave away wealth fund libraries schools churches organizations benefit mankind Watch
938,
939,NEW RELEASE Entertainment journalist ChristianToto explores Tinsel Town top star lowest crew member fall side political spectrum
940,It criticize Israel It entirely existence Jewish state
941,It ColumbusDay Once celebrated explorer controversial Was Christopher Columbus hero villain michaeljknowles answer
942,Stop sexualization kids Sign petition
943,Columbus Hero villain billmaher
944,Wokeness shield cruel armored false virtue elonmusk
945,Should 5 year allowed gender reassignment surgery AmiHorowitz asks students Watch full video
946,No anti Israel anti Jewish They hand hand charliekirk11 DennisPrager
947,Should Columbus Day celebrated
948,What
949,Government addicted spending Someone cut
950,Reliving moment RubinReport larryelder amalaekpunobi
951,It time wake
952,What America left wanted
953,WATCH AmiHorowitz takes campus UCLA Is 5 year equipped make permanent decision
954,Oil natural gas coal provide 84 world energy That percentage points twenty years ago Oil powers 97 global transportation
955,One easiest impactful ways fight left joining PragerUnited monthly giving club Join 35 month receive quarterly gifts It easy make difference
956,Do flaws make beautiful flawsome Watch latest Fireside Chat
957,John F Kennedy lowered taxes opposed abortion supported gun rights believed strong military He proud Democrat
958,Was Civil War About Slavery
959,billmaher The talk slavery days uniquely American invented 1619
960,Is Halloween costume offensive thewillwitt
961,City dwellers Has increase crime made consider moving
962,FREE healthcare means low quality healthcare
963,When Iranian leaders death America Ambassador robertcobrien sits PragerU CEO StreitMarissa Watch full talk HERE
964,This ridiculous amalaekpunobi
965,No government voluntarily reduces size Ronald Reagan
966,Where elonmusk move Twitter headquarters
967,Parents Do kids truth Christopher Columbus This animated episode explains honor Columbus teaches elementary students judge events past standards today
968,Gabriel Nadales angry bitter unhappy young perfect recruit Antifa found
969,A honest slogan Antifa Fighting imaginary fascism actual fascism
970,
971,The 5 popular states move 2022 1 New Jersey2 California3 Illinois4 New York5 Connecticut
972,Stop sexualization kids Sign petition
973,RT amalaekpunobi Kanye Tucker Carlson Andrew Tate Piers Morgan amp TikTok Reactions Unapologetic LIVE
974,Ami Campus What college students 5 year transitioning AmiHorowitz finds
975,StreitMarissa posed question former National Security Advisor robertcobrien
976,Is Chinese owned TikTok national security threat
977,Iran lied nuclear program start currently seeking bomb Ambassador robertcobrien Watch talk StreitMarissa
978,Americans These gas prices crushing family Government Buy electric car
979,NEW RELEASE Are young children capable making life altering decisions AmiHorowitz UCLA sign petition support fictitious 5 year girl boy parents judgment
980,NEW RELEASE Ambassador robertcobrien served former national security advisor President Trump talks foreign policy PragerU CEO StreitMarissa Watch full episode
981,The purpose Constitution restrict government
982,Inflation crushing hard working Americans
983,robertcobrien served National Security Advisor President Trump There orchestrated Abraham Accords changed geopolitical landscape Middle East He shares StreitMarissa thoughts Russia
984,Watch full episode
985,Columbus Hero villain
986,What ultimate source morality
987,Should You Embrace Your Flaws Watch ALL NEW Fireside Chat
988,amalaekpunobi WATCH amalaekpunobi needed analysis
989,amalaekpunobi
990,Myth Prisons overcrowded violent charges Rafa_Mangual reminds prison reason Here facts
991,If America systemically racist explain THIS
992,The greatest security threat West comment
993,RT prageru Energy independence urgent national security issue
994,College today expensive Do college graduates educated literate versed classical philosophy American history ten twenty fifty years ago
995,
996,Is digital ID step social credit system
997,When system reaching repercussions adamcarolla amalaekpunobi
998,RT JillSimonian Research proves exposing kids sexually driven situations developmentally ready permanently
999,How Big Business woke
1000,
1001,Capitalism makes Socialism takes
1002,The free speech test
1003,Student loan forgiveness scam InezFeltscher
1004,Current suspects
1005,Global hurricane activity Is increasing decreasing
1006,If humans responsible causing hurricanes caused prehistoric hurricanes
1007,WATCH MattWalshBlog Slandered elonmusk Buys Twitter amp amalaekpunobi Tests Positive Non Binary Unapologetic LIVE
1008,When faculty safe space
1009,larryelder Why gun control advocates stop lives SAVED firearms
1010,adamcarolla amalaekpunobi Do BLM tattoo
1011,If Washington sword American Revolution Jefferson pen Adams engine
1012,Watch latest 5 Minute Video
1013,Take poll
1014,You I proof Morgan Freeman
1015,Even believe God wish
1016,Is elonmusk buying Twitter America
1017,One easiest impactful ways fight left joining PragerUnited monthly giving club Join 35 month receive quarterly gifts It easy make difference
1018,How deal woke friends
1019,Demonizing masculinity toxic
1020,elonmusk
1021,WATCH White People Cannibalize Black People amalaekpunobi
1022,drmistercody Means parents decide send children school government
1023,Illegal Immigrants cost Americans 200 billion annually
1024,FoxNews Professor cultural appropriation I put level white supremacy amalaekpunobi DrPhil
1025,
1026,Would Walt Disney recognize company today
1027,Policy matters
1028,Cultural appropriation Where DrPhil amalaekpunobi
1029,Identity socialism aims divide DineshDSouza
1030,nypost What
1031,Imitation appropriation amalaekpunobi amp DrPhil KimKardashian
1032,Ease greater threat progress hardship Denzel Washington
1033,Fund children schools
1034,College tuition soaring Why aid government helps
1035,Parents demanding And deserve So kids DeAngelisCorey
1036,Do lives matter
1037,YeonmiParkNK shares harrowing journey escape hunger control violence experienced living authoritarian regimes North Korea China She cautions Americans early warning signs Watch
1038,RT amalaekpunobi That Time I Went On The Dr Phil Show Unapologetic LIVE
1039,Bros bombs box office Guess blame amalaekpunobi
1040,Dennis Prager answers question latest 5 Minute video
1041,Does life meaning God
1042,NEW RELEASE Did Founding Fathers referred Deuteronomy book Hebrew Bible source What book special Dennis Prager answers
1043,Renewable energy sounds great lights turn
1044,I fear God And I fear Kanye West
1045,About term Latinx
1046,Personal responsibility freedom
1047,What invest StreitMarissa JTLonsdale
1048,
1049,NEW RELEASE Did Founding Fathers referred Deuteronomy book Hebrew Bible source What book special Dennis Prager answers
1050,This result socialism
1051,Who tolerant Israelis Palestinians
1052,Here make real impact Join PragerU monthly giving club thousands fellow donors committed keeping PragerU videos free changing millions young minds
1053,Why progressive Americans support despise values Watch rest AmiHorowitz interview
1054,
1055,If child college spends years partying skipping class playing video games consider lucky It listen radical professors trouble charliekirk11
1056,Don blame Fix
1057,He 30 years
1058,Has DrPhil amalaekpunobi thewillwitt
1059,
1060,StreitMarissa JTLonsdale fascinating conversation
1061,amalaekpunobi amalaekpunobi RubinReport
1062,XAVIAERD set debunk PragerU videos Then happened
1063,This awkward Classic TV moment piersmorgan
1064,
1065,Why transgender lions zebras Just humans
1066,What campus ultimately infect culture
1067,Contort language control culture Next stop healthcare joerogan SethDillon amalaekpunobi
1068,johnrich pulling back veil amalaekpunobi
1069,
1070,Imitation appropriation amalaekpunobi amp DrPhil KimKardashian
1071,Professor cultural appropriation I put level white supremacy
1072,Has DrPhil amalaekpunobi thewillwitt
1073,Is Halloween costume offensive thewillwitt
1074,
1075,Catch amalaekpunobi thewillwitt ttrandahl DrPhil today Check local listings watch
1076,OUT NOW New episode Real Talk JTLonsdale StreitMarissa Watch HERE
1077,Wise words jordanbpeterson
1078,JTLonsdale joins StreitMarissa BRAND NEW episode Real Talk Watch HERE
1079,TODAY DrPhil amalaekpunobi thewillwitt ttrandahl Check local listings watch
1080,The reason collectivist types hate I number I jordanbpeterson
1081,Can anti Israel anti Jewish Progressives They wrong
1082,Who real antisemites The left common Nazi Germany
1083,Entrepreneur JTLonsdale immensely successful technology sector years Now starting university aiming compete Ivy League bring back civil discourse teach value Western Civilization StreitMarissa
1084,NEW Fireside Chat
1085,How hard obtain ID
1086,Freedoms lost rarely regained
1087,Praying Florida DennisPrager
1088,Tomorrow Catch amalaekpunobi thewillwitt amp ttrandahl DrPhil
1089,NEW Fireside Chat Why You Should Honor Your ParentsWatch full episode HERE
1090,WATCH amalaekpunobi revisiting VIRAL red pill moment larryelder amp RubinReport
1091,Colleges produce fragile students Example Berkeley
1092,Energy independence urgent national security issue
1093,More power power government At time radical idea
1094,Watch trailer amalaekpunobi thewillwitt ttrandahl
1095,Tomorrow DrPhil
1096,We Floridians dealing aftermath destruction left Hurricane Ian Our prayers family friends impacted May God bless protect loved
1097,Jordan Peterson emotional response called bigot Well
1098,Frederick Douglass born slavery heroic efforts influential advocates freedom American history
1099,Our society suffers presentism constantly judging past today lens
1100,Entitlement toxic
1101,NEW RELEASE The American Revolution led birth free nation French Revolution led blood terror yhazony joins michaeljknowles discussion Edmund Burke Reflections Revolution France Watch
1102,WATCH REACTION TikTok Tips On Life amp Love amalaekpunobi
1103,Prince Charming work fiction amalaekpunobi
1104,Step 1 promise benefits Step 2 attract millions foreigners benefits Step 3 efforts control entry Step 4 grant citizenship vote Step 5 win election TuckerCarlson
1105,The left Give soul give freedom I give benefits TheBabylonBee
1106,James Madison
1107,MattWalshBlog This learn James Madison
1108,Can derive morality nature
1109,RT larryelder amalaekpunobi Show prageru Debunking 3 Major Myths Of Systemic Racism In America w Larry Elder
1110,Should trans athletes compete Olympics
1111,NEW BOOK CLUB yhazony joins michaeljknowles discussion Edmund Burke Reflections Revolution France relates world today Watch full episode
1112,When conservative Hollywood ksorbs
1113,Who peace Middle East Watch RealSarahIdan present latest 5 Minute Video
1114,The inconvenient truth
1115,
1116,To day person Miss Iraq 2017 family return home Iraq This
1117,Debunking 3 Major Myths Of Systemic Racism In America larryelder
1118,Go watch
1119,Coming 3pm PT 6pm ET Don miss amalaekpunobi larryelder
1120,Have lost friends political differences
1121,Voter ID laws racist
1122,The American Revolution led birth free nation French Revolution led blood terror What difference yhazony joins michaeljknowles discussion Edmund Burke Reflections Revolution France
1123,This industry screams tolerance stuff completely street Kevin Sorbo ksorbs
1124,Who responsible current energy crisis Europe
1125,Why teacher loves teaching quit job Her answer alarm
1126,Reason antidote fear
1127,Your electric car powered fossil fuels
1128,It different world
1129,When preserving American values radical idea thewillwitt
1130,Which takes faith 1 Believing complex universe chance 2 Believing universe intentionally created
1131,Watch Fireside Chat
1132,Stifling opposing viewpoints hard left ugliest traits
1133,WATCH Rules Thee Buzzfeed 21 Unwritten Rules Black People amalaekpunobi
1134,RT HollywoodInToto Next week I officially prageru adjunct professor So excited team creative dept made
1135,RT JoeBanner13 If opinion Israel watch The propaganda Israel reality
1136,What separates west rest
1137,Here I girl amalaekpunobi reacts
1138,Is fascism left wing ideology The answer
1139,The_Kyle_Mann We academic school
1140,NEW RELEASE RealSarahIdan woman represent Iraq Miss Universe contest half century She made friends Miss Israel changed expected WATCH
1141,
1142,If history teach private property inextricably linked civilization Ludwig Von Mises
1143,This patriarchy amalaekpunobi
1144,NEW RELEASE RealSarahIdan woman represent Iraq Miss Universe contest half century She made friends Miss Israel changed expected
1145,If America racist ethnic racial backgrounds world fight hard move
1146,Educating donlemonon history slavery amalaekpunobi
1147,There truth
1148,RT prageru Economic growth entrepreneurs risking OWN money politicians risking YOUR money
1149,RT johnrich Not surprising Weak
1150,Can pass U S citizen test
1151,I fear God And I fear
1152,What assault rifle
1153,It speech protecting
1154,The free market system It Washington implements It exist legislation law bill regulation book It act entirely central direction Jeffrey Tucker
1155,In competition matters winning That means excellence matters And colorblind WhitlockJason
1156,All tyranny foothold conscience remain silent Edmund Burke
1157,RT larryelder Amala Ekpunobi amalaekpunobi Prager U prageru
1158,
1159,I
1160,Students saddled debt show Learn
1161,
1162,Liberty Equality Fraternity vs Life Liberty pursuit Happiness What French Revolution wrong Watch full episode
1163,Stifling opposing viewpoints hard left ugliest traits
1164,Economic growth entrepreneurs risking OWN money politicians risking YOUR money
1165,Values instincts Which YOU follow
1166,If stunning indictment soulless godless totalitarian domination read Aldous Huxley Brave New World tedcruz michaeljknowles
1167,RT amalaekpunobi Don Worry Darling Is A FEMINIST FEVER DREAM amp Dennis Prager Debates ANGRY Leftist
1168,Our society suffers presentism
1169,
1170,RT prageru Who control southern border
1171,Why feminists fight Muslim women Ayaan
1172,Young drift left believe left superior exposed
1173,Who control southern border
1174,Who responsible suffering live Gaza While Israel rockets defense terrorist group Hamas hides civilians Why media hard twist reality
1175,RT prageru XAVIAERD set debunk PragerU videos Then happened
1176,Watch debate DennisPrager vs AnaKasparian
1177,Values vs Instincts Which follow Watch All New Fireside Chat
1178,Can make CRINGE TikToks Ft RubinReport
1179,RT cenkuygur Kasper vs Prager tonight TheYoungTurks The live show started debate 7 30PM Watch http
1180,RT TheYoungTurks This debate happening today AnaKasparian DennisPrager TheYoungTurks live starting 6pm ET 3pm
1181,This interesting
1182,He reduced scope reach federal government cutting taxes lowering spending retiring half national debt Where today
1183,Americans generous They spirit generosity advantage
1184,Don miss
1185,Don buy scam
1186,What white wokeness
1187,This patriarchy amalaekpunobi
1188,What matters
1189,What culture
1190,The founders country understood morally weak religion encouragement incentive
1191,As tempting politicians blame
1192,What
1193,These decisions irreversible
1194,RT amalaekpunobi THE REAL WAR ON WOMEN My Thoughts On Iran amp Mahsa Amini
1195,johnrich pulling back veil amalaekpunobi
1196,GET 20 OFF entire store
1197,Throughout history slavery rule exception The exception abolition
1198,Of course Southern states wanted slaves counted fifths persons population slave states greater give South power House Representatives Learn
1199,The Northern abolitionists slaves counted Why Because slaves counted population Southern slave states increased consequently political influence anti slavery North decreased
1200,The 3 5 Compromise valuing slaves fully human
1201,Do electricity
1202,RT prageru VICENews stopped studios feature PragerU young conservatives GiannaToboni Watch trailer
1203,Gender confusion children prevalent
1204,XAVIAERD set debunk PragerU videos Then happened
1205,What happened Disney
1206,Nothing contributes prosperity happiness country high profits David Ricardo
1207,VICENews stopped studios feature PragerU young conservatives GiannaToboni Watch trailer catch full episode Showtime
1208,Learn
1209,Do fear social credit system China America lifetime
1210,Educating donlemon history slavery amalaekpunobi
1211,johnrich Maren Morris vs Brittany Aldean amp Country Music Going WOKE amalaekpunobi
1212,Watch answer
1213,Senators serve ____ terms
1214,Real comedy attack Watch AdamCarolla explain
1215,Thanks Elex_Michaelson FOXLA TheIssueIsShow
1216,Cancel culture eroding America Watch full episode
1217,Are living socialism Brazil case study FMouraBrasil explains country fared socialism
1218,That learn lessons history important lessons history Aldous Huxley
1219,Cancel culture eroding America It person especially media Hollywood stand Comedian podcast host adamcarolla explains
1220,Perspective billmaher amalaekpunobi
1221,For dollar student loan money government makes available university tuition 60 cents
1222,The law unintended consequences
1223,Watch megynkelly amalaekpunobi
1224,Pro sports woke sports
1225,Watch answer learn Constitution
1226,How sections Article I U S Constitution
1227,Look source society collapse find word inflation
1228,RT amalaekpunobi JUBILEE REACTION Trans Teens Talk Gender Unapologetic LIVE
1229,Why hate West
1230,NEW RELEASE The Framers United States Constitution wanted give power power government This radical idea John Yoo Professor Law University California Berkeley explains
1231,Should America border wall
1232,If counting Social Security finance retirement count
1233,Coincidence
1234,Real Real stories Real Talk StreitMarissa Don miss authentic conversations PragerU CEO Marissa Streit today leaders top respective fields
1235,Freedom value instinct
1236,Favorite TV Dads
1237,You born parents You decisions Watch Anthony full story
1238,NEW RELEASE The Framers United States Constitution wanted give power power government This radical idea John Yoo Professor Law University California Berkeley explains
1239,America president James Monroe America Founding Fathers But giant giants He Author chrisderose tells story
1240,Great question What
1241,Ask control johnrich
1242,Loan forgiveness overwhelmingly benefits privileged
1243,The Treasurer United States charted course enterprise wealth creation Americans reaping rewards
1244,Criminals definition respect gun laws jasonrileywsj
1245,Socialists spend businesses create
1246,Watch
1247,Is racist country protect borders
1248,RT Elex_Michaelson The left destroying America DennisPrager California politics schools
1249,Do walls work
1250,RT prageru Name 1 movie
1251,
1252,Beware promises sound false promises
1253,Feelings change facts
1254,Sticks stones michaeljknowles DennisPrager amalaekpunobi
1255,For transporting oil gas pipelines safest bet Think move Trains move Trucks move Pipelines
1256,Is Halloween costume offensive
1257,RT Elex_Michaelson prageru dominates digital space w conservative themed videos earning 1 billion views year Their archive
1258,RT Elex_Michaelson L A Business Journal recently named prageru places work L A Many employees millennials
1259,Name 1 movie
1260,Watch Fireside Chat
1261,A forgotten aspect open borders Enriching cartels thewillwitt
1262,What
1263,Unity
1264,The writer popular influential history book modern history radical leftist professor despised subject This explains lot
1265,Rationality insufficient world
1266,The million dollar question
1267,johnrich
1268,RT Elex_Michaelson JonathanKeller TheIssueIsShow DennisPrager prageru FOXLA Hope watch
1269,RT johnrich Seems I struck minor chord folks AmericanSongwriter prageru interview I litt
1270,RT Elex_Michaelson This week TheIssueIsShow DennisPrager takes scenes prageru His profit currently 1
1271,Some Americans granted born lower class reach middle upper class Many Brazilians granted
1272,Young hear
1273,
1274,StreitMarissa fascinating interview kimkiyosaki WATCH
1275,You lose friends lot Watch
1276,The game give johnrich
1277,Learn
1278,
1279,
1280,RT amalaekpunobi Martha Vineyard MELTDOWNS amp Dennis Prager Goes Viral AGAIN Unapologetic LIVE
1281,Multiculturalism _______ America
1282,If question science
1283,OUT NOW Watch full discussion kimkiyosaki StreitMarissa
1284,Should Kansas City Chiefs Atlanta Braves names change Washington Commanders Cleveland Guardians
1285,The media seeks ratings truth
1286,Israelis Palestinians Who More Tolerant AmiHorowitzWatch full mini doc
1287,Is America multicultural Watch
1288,RT JillSimonian Instead trick students donuts LASchools teach
1289,NEW RELEASE In episode Real Talk entrepreneur kimkiyosaki PragerU CEO StreitMarissa discuss challenges running million dollar company dispel myth glass ceiling women business
1290,Watch ALL NEW Fireside Chat
1291,NEW RELEASE Is glass ceiling Entrepreneur kimkiyosaki joins PragerU CEO StreitMarissa Watch full interview HERE
1292,Who cares illegal immigration thewillwitt tackles difficult issue
1293,The effective destroy deny obliterate understanding history George Orwell
1294,Break free ideological fortress megynkelly amalaekpunobi
1295,Are cops perfect Of course But single day difficult conditions police protect guys In words job
1296,Capitalism system lifts poverty Steven Crowder explains scrowder
1297,Watch ALL NEW Fireside Chat
1298,Are Michigan schools secretly ENCOURAGING child transitions ft PragerU CEO StreitMarissa amalaekpunobi
1299,Wokeness basically make comedy illegal
1300,Powers scope national government left states
1301,Is leftism escape
1302,
1303,Americans generous They spirit generosity advantage
1304,johnrich fascinating story Hear rest
1305,RT prageru Should open borders matter legal status Is compassionate Is prude
1306,Remember parties wanted strong borders
1307,shoe0nhead
1308,A left lose led hell purgatory amp heaven incomparable masterpiece
1309,Men pregnant
1310,IainLoveTheatre YouTube Help reach young ads making tax deductible donation today
1311,Help reach young ads making tax deductible donation today
1312,I fear God And I fear
1313,Public pensions economic time bomb
1314,Do walls work
1315,When hard work meritocracy racist
1316,The climate changing long humans
1317,Is U S racist country
1318,The triumph evil Edmund Burke
1319,Fix fatherlessness fix America
1320,
1321,Nothing holds back themself victim
1322,Yearn free
1323,RT amalaekpunobi My Thoughts On The Black Little Mermaid amp Race Tension Emmy Unapologetic LIVE
1324,Country singer songwriter johnrich shares moving story start music bending knee woke mob Watch full episode
1325,3 Problems Universal Mail Balloting Bureaucratic incompetence Shoddy security The likelihood long delays determining final results Learn
1326,
1327,RT johnrich Had pleasure interview today amalaekpunobi prageru Will airing What smart feisty
1328,RT prageru If college degree produce value pay value
1329,Closing pipelines consequences
1330,Not appropriate Parents action Visit follow JillSimonian
1331,Watch answer
1332,How U S taxpayers estimated spending year house feed school illegal immigrants
1333,Is college worth investment
1334,Why modern feminism treatment women Muslim countries
1335,What women
1336,A hidden plain sight agenda Who surprised revelation amalaekpunobi
1337,WATCH We Need Talk TikTok Tourette amalaekpunobi
1338,Do percentage Americans pay federal income taxes
1339,Fathers matter
1340,
1341,Beware false promises
1342,Does Israel discriminate Arabs
1343,Wokeism entertainment industry made Nashville Hear country singer songwriter johnrich story
1344,College The place champion diversity insulated echo chamber
1345,RT JillSimonian But honest make life easier DO IT ANYWAYS A PSA teaching students lies
1346,The world absurd satirized G K Chesterton
1347,The trend
1348,You offer solutions address root
1349,RT johnrich Thanks prageru inviting StoriesOfUs interview Check
1350,Wokeism entertainment industry made Nashville Country singer songwriter johnrich shares moving story start music bending knee woke mob
1351,Society masculine
1352,Next time tells wind solar batteries magical solution energy idea cost environment
1353,America opportunity nations country world history
1354,Which party founded KKK
1355,Cancel culture creates cowards
1356,Would trade liberty security
1357,They worried change minds silence
1358,A large chunk 1 75 trillion dollar student loan liability held students graduated
1359,Never Happened larryelder facts
1360,Intimidation harassment blackmail norm American politics Why Because works
1361,Intersectionality hierarchy victimization
1362,Wherever communism famine
1363,Is society banning prayer public schools
1364,
1365,Watch
1366,If send 40 billion dollars country Eastern Europe defend borders unwilling spend half defend border building effective border wall thewillwitt
1367,Women NOT compete athletically biological
1368,Disparity
1369,
1370,The homeless policy environment permissive
1371,Free money incredibly expensive caroljsroth
1372,When character historical figure mind
1373,When truth
1374,Should open borders matter legal status Is compassionate Is prudent thewillwitt lot questions difficult issue
1375,To secure liberties understand
1376,How sports politicized
1377,NeverForget September 11 2001
1378,How protect kids public schools
1379,
1380,Socialism spreads wealth capitalism creates
1381,It kids educated They miseducated
1382,Watch PragerU CEO StreitMarissa interview security expert Bryceeddy1 They discuss stay safe turbulent times Catch full interview HERE
1383,The law abolish restrain preserve enlarge freedom John Locke
1384,This rings especially 9 11 NeverForget
1385,Pro sports woke sports
